{
  "$id": "https://local.codex/post-office-next/contracts/v1/operations/authority.grant.request.schema.json",
  "$schema": "http://json-schema.org/draft-07/schema#",
  "additionalProperties": false,
  "examples": [
    {
      "actor": {
        "id": "PON-ACTOR-001",
        "kind": "HUMAN",
        "role": "author"
      },
      "aggregate": {
        "expectedVersion": 0,
        "id": "PON-AGGREGATE-001",
        "type": "Example"
      },
      "authority": {
        "capabilityId": "PON-CAPABILITY-001",
        "exactAuthorActionId": "PON-AUTHOR-ACTION-001"
      },
      "operation": "authority.grant",
      "parameters": {
        "grant": {
          "allowedOperations": [
            "example"
          ],
          "classification": "ONE_SHOT",
          "grantorId": "PON-EXAMPLE-001",
          "rationale": "example",
          "recipientId": "PON-EXAMPLE-001",
          "scope": {
            "projectIds": [
              "PON-EXAMPLE-001"
            ]
          },
          "sourceDecisionId": "PON-EXAMPLE-001"
        }
      },
      "requestId": "PON-REQUEST-001",
      "schemaVersion": "1"
    }
  ],
  "properties": {
    "actor": {
      "additionalProperties": false,
      "properties": {
        "id": {
          "minLength": 1,
          "pattern": "^[A-Za-z][A-Za-z0-9._:-]{2,127}$",
          "type": "string"
        },
        "kind": {
          "enum": [
            "HUMAN",
            "BROWSER",
            "COURIER",
            "ENDPOINT",
            "SYSTEM"
          ],
          "minLength": 1,
          "type": "string"
        },
        "role": {
          "minLength": 1,
          "type": "string"
        }
      },
      "required": [
        "id",
        "kind",
        "role"
      ],
      "type": "object"
    },
    "aggregate": {
      "additionalProperties": false,
      "anyOf": [
        {
          "required": [
            "expectedVersion"
          ]
        },
        {
          "required": [
            "expectedRoot"
          ]
        }
      ],
      "properties": {
        "expectedRoot": {
          "minLength": 1,
          "pattern": "^(?:sha256:)?[0-9a-f]{64}$",
          "type": "string"
        },
        "expectedVersion": {
          "minimum": 0,
          "type": "integer"
        },
        "id": {
          "minLength": 1,
          "pattern": "^[A-Za-z][A-Za-z0-9._:-]{2,127}$",
          "type": "string"
        },
        "type": {
          "minLength": 1,
          "type": "string"
        }
      },
      "required": [
        "type",
        "id"
      ],
      "type": "object"
    },
    "authority": {
      "additionalProperties": false,
      "properties": {
        "capabilityId": {
          "minLength": 1,
          "pattern": "^[A-Za-z][A-Za-z0-9._:-]{2,127}$",
          "type": "string"
        },
        "exactAuthorActionId": {
          "minLength": 1,
          "pattern": "^[A-Za-z][A-Za-z0-9._:-]{2,127}$",
          "type": "string"
        }
      },
      "required": [
        "capabilityId",
        "exactAuthorActionId"
      ],
      "type": "object"
    },
    "operation": {
      "const": "authority.grant"
    },
    "parameters": {
      "additionalProperties": false,
      "properties": {
        "grant": {
          "additionalProperties": false,
          "properties": {
            "allowedOperations": {
              "items": {
                "minLength": 1,
                "type": "string"
              },
              "minItems": 1,
              "type": "array"
            },
            "classification": {
              "enum": [
                "ONE_SHOT",
                "STANDING"
              ],
              "minLength": 1,
              "type": "string"
            },
            "expiresAt": {
              "minLength": 1,
              "pattern": "^\\d{4}-\\d{2}-\\d{2}T\\d{2}:\\d{2}:\\d{2}(?:\\.\\d+)?Z$",
              "type": "string"
            },
            "grantorId": {
              "minLength": 1,
              "pattern": "^[A-Za-z][A-Za-z0-9._:-]{2,127}$",
              "type": "string"
            },
            "maximumUses": {
              "minimum": 1,
              "type": "integer"
            },
            "rationale": {
              "minLength": 1,
              "type": "string"
            },
            "recipientId": {
              "minLength": 1,
              "pattern": "^[A-Za-z][A-Za-z0-9._:-]{2,127}$",
              "type": "string"
            },
            "scope": {
              "additionalProperties": false,
              "minProperties": 1,
              "properties": {
                "mailDomains": {
                  "items": {
                    "minLength": 1,
                    "pattern": "^[A-Za-z][A-Za-z0-9._:-]{2,127}$",
                    "type": "string"
                  },
                  "minItems": 0,
                  "type": "array"
                },
                "packageIds": {
                  "items": {
                    "minLength": 1,
                    "pattern": "^[A-Za-z][A-Za-z0-9._:-]{2,127}$",
                    "type": "string"
                  },
                  "minItems": 0,
                  "type": "array"
                },
                "projectIds": {
                  "items": {
                    "minLength": 1,
                    "pattern": "^[A-Za-z][A-Za-z0-9._:-]{2,127}$",
                    "type": "string"
                  },
                  "minItems": 0,
                  "type": "array"
                },
                "taskIds": {
                  "items": {
                    "minLength": 1,
                    "pattern": "^[A-Za-z][A-Za-z0-9._:-]{2,127}$",
                    "type": "string"
                  },
                  "minItems": 0,
                  "type": "array"
                }
              },
              "required": [],
              "type": "object"
            },
            "sourceDecisionId": {
              "minLength": 1,
              "pattern": "^[A-Za-z][A-Za-z0-9._:-]{2,127}$",
              "type": "string"
            }
          },
          "required": [
            "grantorId",
            "recipientId",
            "allowedOperations",
            "scope",
            "classification",
            "rationale",
            "sourceDecisionId"
          ],
          "type": "object"
        }
      },
      "required": [
        "grant"
      ],
      "type": "object"
    },
    "requestId": {
      "minLength": 1,
      "pattern": "^[A-Za-z][A-Za-z0-9._:-]{2,127}$",
      "type": "string"
    },
    "schemaVersion": {
      "const": "1"
    }
  },
  "required": [
    "schemaVersion",
    "operation",
    "requestId",
    "actor",
    "authority",
    "parameters",
    "aggregate"
  ],
  "title": "authority.grant request",
  "type": "object",
  "x-contractStatus": "IMPLEMENTED_P3_2",
  "x-minimumAuthority": "author",
  "x-mutates": true
}
